"","created_at","screen_name","text","source","is_quote","is_retweet","favorite_count","retweet_count","quoted_screen_name","retweet_screen_name","status_url","place_full_name"
"WayneMessam.697",2019-01-04 00:11:09,"WayneMessam","I know from my own life that change doesn't happen on its own. Congratulations to Speaker @NancyPelosi We look forward to your leadership. https://t.co/tPxO8W7v0P","Twitter for iPhone",FALSE,FALSE,3,0,NA,NA,"https://twitter.com/WayneMessam/status/1080979912847228928",NA
"WayneMessam.698",2019-01-03 11:14:58,"WayneMessam","There are many more inspiring examples of immigrants and their positive contributions to America. They should be told for they will inspire all Americans to work together in that quest to achieve the American Dream. Serve well Congresswoman @IlhanMN #BeGreat https://t.co/5tGUNKaUf7","Twitter for iPhone",TRUE,FALSE,6,0,"IlhanMN",NA,"https://twitter.com/WayneMessam/status/1080784581459144704","Miramar, FL"
"WayneMessam.699",2019-01-03 11:03:14,"WayneMessam","Are you willing to sacrifice self convenience to reach your goals? https://t.co/68Zfr8VCpJ","Twitter for iPhone",FALSE,FALSE,4,1,NA,NA,"https://twitter.com/WayneMessam/status/1080781627977015296",NA
"WayneMessam.700",2019-01-02 12:08:00,"WayneMessam","https://t.co/i1feHvZmNx","Facebook",FALSE,FALSE,0,0,NA,NA,"https://twitter.com/WayneMessam/status/1080435536316256257",NA
"WayneMessam.701",2019-01-01 22:10:25,"WayneMessam","Patriotism can never be rooted in hate, lynchings, enslavement and Jim Crow. A vote for this bill is affirmation of a very dark history of our nation. I urge every State Senator to vote this bill down. If a community wants these monuments down, So be it! https://t.co/1W1QyajJ7L","Twitter for iPhone",FALSE,FALSE,1,1,NA,NA,"https://twitter.com/WayneMessam/status/1080224753150054402",NA
"WayneMessam.702",2019-01-01 15:36:29,"WayneMessam","Same to you coach! Former players have your back. #Unconquered #89 https://t.co/wjDLWFxyXc","Twitter for iPhone",TRUE,FALSE,0,0,"CoachTaggart",NA,"https://twitter.com/WayneMessam/status/1080125615460810753","Miramar, FL"
"WayneMessam.703",2019-01-01 11:48:42,"WayneMessam","Let<U+2019>s make 2019 the year of greatness. https://t.co/OlpgeJkpHK","Twitter for iPhone",FALSE,FALSE,10,0,NA,NA,"https://twitter.com/WayneMessam/status/1080068294831419393","Miramar, FL"
"WayneMessam.704",2018-12-31 15:42:01,"WayneMessam","As 2018 comes to a close, I am reminded of my roots growing up in South Bay, Florida where my Jamaican Immigrant parents decided to raise their family. They held true to their culture while embracing the Promises... https://t.co/vztUXFMhcF","Facebook",FALSE,FALSE,10,0,NA,NA,"https://twitter.com/WayneMessam/status/1079764621035257856",NA
"WayneMessam.705",2018-12-31 01:05:27,"WayneMessam","My week on Twitter <U+0001F389>: 61 Likes, 5 Retweets, 6.32K Retweet Reach. See yours with https://t.co/u8WroBempT https://t.co/rnvHeFyVUo","SumAll",FALSE,FALSE,0,0,NA,NA,"https://twitter.com/WayneMessam/status/1079544026032934918",NA
"WayneMessam.706",2018-12-30 11:52:54,"WayneMessam","@GOP Not my words but @POTUS words. https://t.co/5PKJATxv0U","Twitter for iPhone",FALSE,FALSE,7,0,NA,NA,"https://twitter.com/WayneMessam/status/1079344575876161536","Miramar, FL"
"WayneMessam.707",2018-12-30 03:41:33,"WayneMessam","My paper the <U+2066>@SunSentinel<U+2069> was also impacted. I wonder if <U+2066>@POTUS<U+2069> will make malware and other foreign threats that attack our systems, #FinTech and our infrastructure a priority. I fear these threats over a mother and child seeking asylum. https://t.co/uvIhA7ZDeu","Twitter for iPhone",FALSE,FALSE,2,1,NA,NA,"https://twitter.com/WayneMessam/status/1079220921725009920",NA
"WayneMessam.708",2018-12-30 01:00:26,"WayneMessam","Not only will federal workers be subjected to furloughed pay but they will not get their annual increase. All while @realDonaldTrump personally benefits by being POTUS. https://t.co/pWzAROgar1","Twitter for iPhone",FALSE,FALSE,2,0,NA,NA,"https://twitter.com/WayneMessam/status/1079180376701046784","Royal Palm Beach, FL"
"WayneMessam.709",2018-12-29 23:37:17,"WayneMessam","When hurricanes strike, residents must be protected, informed &amp; comforted. I<U+2019>m proud of the way our community &amp; city staff came together to restore &amp; clean up our city. Donate today https://t.co/XbjhnFPfaa #MiramarTogether #ReElectMayorWayneMessam #MiramarTogether 
#HurricaneIrma https://t.co/v78iYA2RrT","Twitter for iPhone",FALSE,FALSE,3,1,NA,NA,"https://twitter.com/WayneMessam/status/1079159448655011845",NA
"WayneMessam.710",2018-12-28 21:31:23,"WayneMessam","Mr. Overton, thank you for your service to our nation. May your life and legacy serve to remind us how far we have come as a nation and how we must never let tyranny domestic or abroad trump trump Freedom, Peace and Equity! https://t.co/gSKO4xpBOc","Twitter for iPhone",FALSE,FALSE,3,0,NA,NA,"https://twitter.com/WayneMessam/status/1078765377239351297",NA
"WayneMessam.711",2018-12-26 16:17:28,"WayneMessam","Happy Kwanzaa! May the Principles of Kwanzaa -  Umoja (Unity), Kujichagulia (Self-Determination), Ujima (Collective Work and Responsibility), Ujamaa (Cooperative Economics), Nia (Purpose), Kuumba (Creativity) &amp; Imani (Faith) serve as common bonds for our nation. https://t.co/G8HzHh3IEk","Twitter for iPhone",FALSE,FALSE,12,0,NA,NA,"https://twitter.com/WayneMessam/status/1077961604623462401","Miramar, FL"
"WayneMessam.712",2018-12-25 15:52:12,"WayneMessam","Chief Williams and the entire Miramar Police Department family wish you a safe and happy holiday. Merry Christmas! <U+0001F384><U+0001F385> https://t.co/XOfOmGFw73","Twitter for iPhone",FALSE,TRUE,0,7,NA,"MiramarPD","https://twitter.com/WayneMessam/status/1077592859031887873",NA
"WayneMessam.713",2018-12-24 14:36:28,"WayneMessam","May the Gift of Christmas bring Joy, Peace and Love to You and Yours. Happy Holidays from the Messam Family. https://t.co/jpJtrqZ4Zc","Twitter for iPhone",FALSE,FALSE,18,2,NA,NA,"https://twitter.com/WayneMessam/status/1077211409010823170","Miramar, FL"
"WayneMessam.714",2018-12-24 12:10:36,"WayneMessam","Have a Merry Christmas Miramar! https://t.co/RvqVAtPybj","Twitter for iPhone",TRUE,FALSE,5,1,"CityofMiramar",NA,"https://twitter.com/WayneMessam/status/1077174700655198208","Miramar, FL"
"WayneMessam.715",2018-12-24 11:59:21,"WayneMessam","United Data Technologies opens headquarters in Miramar further strengthening <U+2066>@CityofMiramar IT Sector and diversifying an economy ranked as one of the fastest growing in the nation. <U+2069> - South Florida Business Journal  https://t.co/Sz2xoqetVz","Twitter for iPhone",FALSE,FALSE,4,1,NA,NA,"https://twitter.com/WayneMessam/status/1077171871219679232",NA
"WayneMessam.716",2018-12-24 01:56:46,"WayneMessam","Had a great time with our mentees today at the Miami Dolphins game. Thanks to Jason Jenkins and the Dolphins for inviting our My Brother<U+2019>s Keeper Program for a great time at Hard Rock Stadium. Earlier this year,... https://t.co/9lo7wWPsPo","Facebook",FALSE,FALSE,2,0,NA,NA,"https://twitter.com/WayneMessam/status/1077020223755014145",NA
"WayneMessam.717",2018-12-24 01:05:55,"WayneMessam","My week on Twitter <U+0001F389>: 3 Mentions, 724 Mention Reach, 17 Likes, 1 Retweet, 3.02K Retweet Reach. See yours with https://t.co/u8WroBempT https://t.co/35lgopGT73","SumAll",FALSE,FALSE,0,0,NA,NA,"https://twitter.com/WayneMessam/status/1077007428745658368",NA
"WayneMessam.718",2018-12-23 12:42:59,"WayneMessam","@nbc6 Across this nation we must eradicate any and all discriminatory rules, policies and protocols that unjustly rip a person<U+2019>s sense of self, worth and dignity. Hair can be regrown but broken hearts may never be healed.","Twitter for iPhone",FALSE,FALSE,4,0,NA,NA,"https://twitter.com/WayneMessam/status/1076820463073009664","Miramar, FL"
"WayneMessam.719",2018-12-23 06:41:16,"WayneMessam","https://t.co/K4zeIHauXj","Facebook",FALSE,FALSE,0,0,NA,NA,"https://twitter.com/WayneMessam/status/1076729434772783105",NA
"WayneMessam.720",2018-12-23 06:18:48,"WayneMessam","https://t.co/kq8p1O9EWF","Facebook",FALSE,FALSE,0,0,NA,NA,"https://twitter.com/WayneMessam/status/1076723780335095808",NA
"WayneMessam.721",2018-12-22 21:12:03,"WayneMessam","Never should we tolerate a Congress and a President hurting the American people to make a political point. These shutdowns must end. No ban, no wall. https://t.co/ljeAwXGMUA","Twitter for iPhone",FALSE,FALSE,5,0,NA,NA,"https://twitter.com/WayneMessam/status/1076586186729230336",NA
"WayneMessam.722",2018-12-22 15:58:34,"WayneMessam","Across this nation we must eradicate any and all discriminatory rules, policies and protocols that unjustly rip a person<U+2019>s sense of self, worth and dignity. Hair can be regrown but broken hearts may never be healed. https://t.co/jQM51UYRaX","Twitter for iPhone",TRUE,FALSE,5,1,"TODAYshow",NA,"https://twitter.com/WayneMessam/status/1076507295155212290","Miramar, FL"
"WayneMessam.723",2018-12-22 04:01:03,"WayneMessam","Messam Construction Holiday Dinner. Blessed to have team of Construction Management professionals who are committed to turning <U+201C>Designs To Life<U+201D> https://t.co/1k2WenhXwF","Twitter for iPhone",FALSE,FALSE,11,0,NA,NA,"https://twitter.com/WayneMessam/status/1076326728044371968","The Betsy - South Beach"
"WayneMessam.724",2018-12-21 12:21:16,"WayneMessam","The most beautiful City Hall in the world. City of Miramar  @ Mayor Wayne Messam <U+2014> at Mayor Wayne Messam https://t.co/EBMUQMzQDy","Facebook",FALSE,FALSE,6,1,NA,NA,"https://twitter.com/WayneMessam/status/1076090222293733376",NA
"WayneMessam.725",2018-12-17 01:05:49,"WayneMessam","My week on Twitter <U+0001F389>: 5 Mentions, 46.9K Mention Reach, 35 Likes, 19 Retweets, 38.4K Retweet Reach. See yours with https://t.co/u8WroBempT https://t.co/sZzQCatnJQ","SumAll",FALSE,FALSE,0,0,NA,NA,"https://twitter.com/WayneMessam/status/1074470688562601985",NA
"WayneMessam.726",2018-12-15 14:45:58,"WayneMessam","Miramar Breakfast with Santa https://t.co/fVCWei56Ye","Facebook",FALSE,FALSE,0,0,NA,NA,"https://twitter.com/WayneMessam/status/1073952311846846464",NA
"WayneMessam.727",2018-12-10 17:06:43,"WayneMessam","#IBelieve you have, right now, everything you need to accomplish every goal you have.  So, go ahead and #BeGreat https://t.co/rZHiB1624p","Twitter for iPhone",FALSE,FALSE,3,0,NA,NA,"https://twitter.com/WayneMessam/status/1072175789838344193","Country Club, FL"
"WayneMessam.728",2018-12-10 15:45:39,"WayneMessam","If America can have the largest economy and lead in the advancement of the most amazing technology in the world, we can also solve this challenge of providing healthcare for all. #IBelieve #BeGreat","Twitter for iPhone",FALSE,FALSE,5,0,NA,NA,"https://twitter.com/WayneMessam/status/1072155392115904514","Miramar, FL"
"WayneMessam.729",2018-12-10 15:45:39,"WayneMessam","I believe access to healthcare should be a priority for federal, state and local government for the American people. One that doesn<U+2019>t only pick the healthiest and wealthiest Americans but that is compassionate enough to also cover the sickest and the poorest of our nation. https://t.co/NtGVhKXAbp","Twitter for iPhone",TRUE,FALSE,3,0,"BarackObama",NA,"https://twitter.com/WayneMessam/status/1072155389129621509","Pembroke Pines, FL"
"WayneMessam.730",2018-12-10 03:59:51,"WayneMessam","https://t.co/bNRuAAKbOo","Twitter for iPhone",FALSE,FALSE,3,0,NA,NA,"https://twitter.com/WayneMessam/status/1071977768559304704","Miramar, FL"
"WayneMessam.731",2018-12-10 02:24:31,"WayneMessam","One day she will fly a mission that will protect a nation. There is no limit to her potential and that is why we inspire. Mayor Wayne Messam<U+2019>s #AviationExpo presented by Spirit Airlines","Facebook",FALSE,FALSE,2,0,NA,NA,"https://twitter.com/WayneMessam/status/1071953780382580736",NA
"WayneMessam.732",2018-12-10 01:06:18,"WayneMessam","My week on Twitter <U+0001F389>: 11 Mentions, 100K Mention Reach, 62 Likes, 12 Retweets, 16.2K Retweet Reach. See yours with https://t.co/u8WroBempT https://t.co/8kxkipbn9q","SumAll",FALSE,FALSE,1,1,NA,NA,"https://twitter.com/WayneMessam/status/1071934093837910017",NA
"WayneMessam.733",2018-12-09 17:57:20,"WayneMessam","Christmas should be celebrated but for believers, also celebrate the Gift (Baby) @WayneBLomax","Twitter for iPhone",FALSE,FALSE,0,0,NA,NA,"https://twitter.com/WayneMessam/status/1071826141621731329",NA
"WayneMessam.734",2018-12-09 17:51:17,"WayneMessam","<U+201C>The Gift is also The Prince of Peace. Steps in during our chaos<U+201D>. @WayneBLomax","Twitter for iPhone",FALSE,FALSE,0,0,NA,NA,"https://twitter.com/WayneMessam/status/1071824620762865664",NA
"WayneMessam.735",2018-12-09 17:47:54,"WayneMessam","Relationships can be seasonal but the Father<U+2019>s relationship is everlasting. @WayneBLomax","Twitter for iPhone",FALSE,FALSE,0,0,NA,NA,"https://twitter.com/WayneMessam/status/1071823766483861504",NA
"WayneMessam.736",2018-12-09 17:43:27,"WayneMessam","A counselor who doesn<U+2019>t judge but one who accepts you as you are. @WayneBLomax","Twitter for iPhone",FALSE,FALSE,1,0,NA,NA,"https://twitter.com/WayneMessam/status/1071822648055906304",NA
"WayneMessam.737",2018-12-09 17:42:28,"WayneMessam","This Gift doesn<U+2019>t rule from the top down but the bottom up.","Twitter for iPhone",FALSE,FALSE,0,0,NA,NA,"https://twitter.com/WayneMessam/status/1071822401057538048",NA
"WayneMessam.738",2018-12-09 17:40:02,"WayneMessam","A peculiar gift was given (A Baby) @WayneBLomax","Twitter for iPhone",FALSE,FALSE,0,0,NA,NA,"https://twitter.com/WayneMessam/status/1071821788248764418",NA
"WayneMessam.739",2018-12-09 17:23:43,"WayneMessam","Christmas is a secular and sacred holiday.","Twitter for iPhone",FALSE,FALSE,0,0,NA,NA,"https://twitter.com/WayneMessam/status/1071817683090456576",NA
"WayneMessam.740",2018-12-09 17:23:42,"WayneMessam","Spiritual Sobriety is a great asset if embraced. Enjoying church today @TFCMiamiGardens. Sermon Title: A Peculiar Gift. Will share notes from the sermon. @WayneBLomax https://t.co/ajWNVEVcgt","Twitter for iPhone",FALSE,FALSE,1,1,NA,NA,"https://twitter.com/WayneMessam/status/1071817679353380865","The Fountain of New Life"
"WayneMessam.741",2018-12-09 17:19:12,"WayneMessam","What an awesome experience <U+0001F64C><U+0001F3FE><U+0001F64C><U+0001F3FE> https://t.co/mM8hwe7Xyc","Twitter for iPhone",FALSE,TRUE,0,6,NA,"MiramarYAC","https://twitter.com/WayneMessam/status/1071816544135589889",NA
"WayneMessam.742",2018-12-09 14:58:30,"WayneMessam","Leaders have a choice, create opportunities to inspire, motivate and challenge our future leaders or do nothing. What<U+2019>s your choice? #MayorMessamAviationExpo https://t.co/4cyBJOBvI7","Twitter for iPhone",FALSE,FALSE,2,0,NA,NA,"https://twitter.com/WayneMessam/status/1071781139176718336","Miramar, FL"
"WayneMessam.743",2018-12-09 14:52:18,"WayneMessam","Minds have been inspired and future aviators were born! #MayorMessamAviationExpo https://t.co/FcQofTp6tM","Twitter for iPhone",FALSE,FALSE,0,0,NA,NA,"https://twitter.com/WayneMessam/status/1071779577117270018",NA
"WayneMessam.744",2018-12-09 14:17:29,"WayneMessam","Many thanks to @browardsheriff Office who provided their brand new Airbus Chopper as a display and families &amp; future aviators had an opportunity to go inside the chopper. #MayorMessamAviationExpo https://t.co/viYbAvDpVP","Twitter for iPhone",FALSE,FALSE,6,3,NA,NA,"https://twitter.com/WayneMessam/status/1071770813957898240","Miramar, FL"
"WayneMessam.745",2018-12-09 14:14:46,"WayneMessam","Many thanks to @FLLFlyer  Director Mark Gale and COO Michael Nonnemacher for helping Team Messam transform The Miramar Amphitheater at Regional Park into an airport experience. https://t.co/c31IfbuGXd","Twitter for iPhone",FALSE,FALSE,5,2,NA,NA,"https://twitter.com/WayneMessam/status/1071770132190511111","Miramar Regional Park"
"WayneMessam.746",2018-12-09 13:54:32,"WayneMessam","Many thanks to Fort Lauderdale-Hollywood International Airport Director Mark Gale and CFO Michael Nonnemacher for helping Team Messam transform The Miramar Amphitheater at Regional Park into an airport... https://t.co/bm2Ltg03PN","Facebook",FALSE,FALSE,2,0,NA,NA,"https://twitter.com/WayneMessam/status/1071765039340838913",NA
"WayneMessam.747",2018-12-08 22:21:15,"WayneMessam","@SpiritAirlines your team was looking great at @CityofMiramar Aviation Expo
#STEM #Robotics https://t.co/DrJrcbpH13","Twitter for iPhone",FALSE,TRUE,0,2,NA,"JPHS","https://twitter.com/WayneMessam/status/1071530171839201286",NA
"WayneMessam.748",2018-12-08 22:20:06,"WayneMessam","What an amazing partnership. #FLL <U+0001F64F><U+0001F3FE><U+0001F64F><U+0001F3FE><U+0001F64F><U+0001F3FE><U+0001F64F><U+0001F3FE><U+0001F64F><U+0001F3FE><U+0001F64F><U+0001F3FE><U+0001F64F><U+0001F3FE> https://t.co/qzQ773DSSP","Twitter for iPhone",TRUE,FALSE,4,1,"FLLFlyer",NA,"https://twitter.com/WayneMessam/status/1071529881626927104","Miramar, FL"
"WayneMessam.749",2018-12-07 23:22:57,"WayneMessam","City of Miramar Holiday Lighting at Town Center https://t.co/ZAiLiI6uKR","Facebook",FALSE,FALSE,2,2,NA,NA,"https://twitter.com/WayneMessam/status/1071183309470949376",NA
"WayneMessam.750",2018-12-07 23:03:10,"WayneMessam","<U+2066><U+2066><U+2066>@CityofMiramar<U+2069> Mourns the loss of U.S. Marine pilot from Miramar killed in fighter jet collision off Japan https://t.co/znqK4Tq4gY","Twitter for iPhone",FALSE,FALSE,6,5,NA,NA,"https://twitter.com/WayneMessam/status/1071178331104661505",NA
"WayneMessam.751",2018-12-07 19:32:04,"WayneMessam","@PRGuttikondaUSA Miramar supports Cricket. We have ball fields where many matches are played and we even have batting cages.","Twitter for iPhone",FALSE,FALSE,0,0,NA,NA,"https://twitter.com/WayneMessam/status/1071125204825444355","Miramar, FL"
"WayneMessam.752",2018-12-07 19:30:33,"WayneMessam","#FLL transformed the @CityofMiramar  Amphitheater into an airport checkin experience. Simply amazing! See you Saturday Dec. 8th at 9AM https://t.co/p86V8lY2TF","Twitter for iPhone",TRUE,FALSE,6,3,"FLLFlyer",NA,"https://twitter.com/WayneMessam/status/1071124826688012290","Miramar, FL"
"WayneMessam.753",2018-12-07 12:36:47,"WayneMessam","So excited to have #FLL at this year<U+2019>s #MayorMessamAviationExpo See everyone today and Saturday! https://t.co/Fk6M7pOK3d","Twitter for iPhone",TRUE,FALSE,12,5,"FLLFlyer",NA,"https://twitter.com/WayneMessam/status/1071020697361768448","Miramar, FL"
"WayneMessam.754",2018-12-05 05:02:38,"WayneMessam","Proud of our Noles! https://t.co/z4JbUHeUSW","Twitter for iPhone",TRUE,FALSE,1,0,"floridastate",NA,"https://twitter.com/WayneMessam/status/1070181631842021377","Miramar, FL"
"WayneMessam.755",2018-12-05 01:04:37,"WayneMessam","Mayor Messam's 2nd Annual Aviation Expo presented by @SpiritAirlines Airlines will be featured by @nbc6 Voices hosted by Emmy Award Anchor @JAWANNBC6 Saturday 9AM. Free event at the The Miramar Amp at Regional Park 9AM-3PM #STEM #Aviation #Jobs https://t.co/dZBZMU2ktK","Twitter for iPhone",FALSE,FALSE,14,3,NA,NA,"https://twitter.com/WayneMessam/status/1070121733510844416","Miramar, FL"
"WayneMessam.756",2018-12-04 23:52:51,"WayneMessam","Mayor Wayne Messam's 2nd Annual Aviation Expo presented by Spirit Airlines will be featured by NBC 6 Voices hosted by Emmy Award Anchor Jawan the feature will highlight what to expect at the Aviation Expo that... https://t.co/GTzmMdL3J5","Facebook",FALSE,FALSE,2,1,NA,NA,"https://twitter.com/WayneMessam/status/1070103673102065664",NA
"WayneMessam.757",2018-12-04 14:12:24,"WayneMessam","Happy Founders Day to the Men of Alpha Phi Alpha Fraternity, Inc. 
O Lord, may the true Spirit of Fraternity Rule Our Hearts, Guide Our Thoughts and Control Our Lives, so that we may become through Thee, Servants of All

Bro. Wayne M. Messam
Spr. 1994
I<U+0394>  Chapter - FSU
BB<U+039B> -Miami https://t.co/K2fFCGgIjh","Twitter for iPhone",FALSE,FALSE,6,1,NA,NA,"https://twitter.com/WayneMessam/status/1069957595623030784","Miramar, FL"
"WayneMessam.758",2018-12-03 01:05:42,"WayneMessam","My week on Twitter <U+0001F389>: 9 Mentions, 5.9K Mention Reach, 60 Likes, 10 Retweets, 9.93K Retweet Reach. See yours with https://t.co/u8WroBempT https://t.co/xT1z1gpPQM","SumAll",FALSE,FALSE,0,0,NA,NA,"https://twitter.com/WayneMessam/status/1069397226982727681",NA
"WayneMessam.759",2018-12-02 15:46:10,"WayneMessam","Happy Chanukah to the Jewish Community and may the next 8 days bring lots of cheer with family and friends. https://t.co/ezKiKaXBSc","Twitter for iPhone",FALSE,FALSE,2,1,NA,NA,"https://twitter.com/WayneMessam/status/1069256416609923072","Miramar, FL"
"WayneMessam.760",2018-12-01 12:18:33,"WayneMessam","RIP to our 41st President. He was a Republican who believed you can work with the other side for the benefit of the people. President Bush was a patriot who served this nation. I may not have always agreed with his policies but his service to this nation ranks high on the list. https://t.co/XPxQHaylp6","Twitter for iPhone",TRUE,FALSE,11,3,"BeschlossDC",NA,"https://twitter.com/WayneMessam/status/1068841781154983936","Miramar, FL"
"WayneMessam.761",2018-11-30 22:15:28,"WayneMessam","Will your school fill two buses to come the #MayorMessamAviationExpo to learn about the wonderful industry of Aviation @Annabel_C_Perry @MiramarHigh2019 @msformoso @PrincipalDarbar @EHSPhotos @Glades_MS @sunsetlakeselem https://t.co/V7geqdCZR4","Twitter for iPhone",FALSE,FALSE,4,1,NA,NA,"https://twitter.com/WayneMessam/status/1068629612589195265","Pembroke Pines, FL"
"WayneMessam.762",2018-11-30 20:14:40,"WayneMessam","We look forward to our Miramar youth learning more about aviation.  This year<U+2019>s event is even better than last year<U+2019>s. #MayorMessamAviationExpo https://t.co/P6WO00Grjw","Twitter for iPhone",TRUE,FALSE,4,1,"Annabel_C_Perry",NA,"https://twitter.com/WayneMessam/status/1068599214148632576","Miramar, FL"
"WayneMessam.763",2018-11-30 19:26:29,"WayneMessam","Go Noles https://t.co/ns0octGiXM","Twitter for iPhone",TRUE,FALSE,1,1,"msformoso",NA,"https://twitter.com/WayneMessam/status/1068587085144178688","Miramar, FL"
"WayneMessam.764",2018-11-30 13:16:23,"WayneMessam","The City of Miramar joined the Broward County Public Schools Supplier Diversity Department to discuss procurement opportunities with Minority and Small Business Owners. Other agencies represented included... https://t.co/6Tjy6GaTi0","Facebook",FALSE,FALSE,3,0,NA,NA,"https://twitter.com/WayneMessam/status/1068493947184529409",NA
"WayneMessam.765",2018-11-30 12:02:18,"WayneMessam","<U+0001F534> BREAKING

#Reggae music of #Jamaica<U+0001F1EF><U+0001F1F2> has just been inscribed on the #IntangibleHeritage List! Congratulations! <U+0001F44F>

<U+2139><U+FE0F> https://t.co/1SDzLr4U5F #LivingHeritage https://t.co/7t1jkD2Z8n","Twitter for iPhone",FALSE,TRUE,0,1258,NA,"UNESCO","https://twitter.com/WayneMessam/status/1068475305860435968",NA
"WayneMessam.766",2018-11-30 02:13:08,"WayneMessam","Great event today @miramarcultural by BCPS Diversity Business Event. @waynemessam Great Job at hosting with the various guests, vendors, suppliers and business owners. Priceless<U+2026> https://t.co/KpYZVlmHsv","Twitter for iPhone",FALSE,TRUE,0,1,NA,"RealtorDee1","https://twitter.com/WayneMessam/status/1068327033741168640",NA
"WayneMessam.767",2018-11-29 22:02:25,"WayneMessam","The falsehood of the @realDonaldTrump economy will certainly be fully exposed for the mirage that it is. Mega profits for executives and closed down factories and pink slips for the working class. This is just the beginning. https://t.co/GDXztIKpnK","Twitter for iPhone",TRUE,FALSE,5,4,"CBSNews",NA,"https://twitter.com/WayneMessam/status/1068263939434262529","Miramar, FL"
"WayneMessam.768",2018-11-29 21:56:38,"WayneMessam","Great event in the City of Miramar talking to <U+2066>@WAYNEMESSAM<U+2069> and local businesses. Kudos to <U+2066><U+2066><U+2066>@browardschools<U+2069> procurement and supplier diversity team along with <U+2066>@MDCPSOEO<U+2069> https://t.co/Q39qlvms16","Twitter for iPhone",FALSE,TRUE,0,3,NA,"ToreyAlston","https://twitter.com/WayneMessam/status/1068262485147467781",NA
"WayneMessam.769",2018-11-29 16:05:50,"WayneMessam","Ed Ansin owner of Sunbeam Properties, Channel 7 WSVN and developer of the Miramar Park of Commerce was honored by the City of Miramar and Mayor Wayne Messam for his pioneering contributions that played a... https://t.co/q54lPRgqM3","Facebook",FALSE,FALSE,2,0,NA,NA,"https://twitter.com/WayneMessam/status/1068174201557868545",NA
"WayneMessam.770",2018-11-29 03:58:04,"WayneMessam","#MiramarProud https://t.co/EIZCQlXnQm","Twitter for iPhone",TRUE,FALSE,2,0,"msformoso",NA,"https://twitter.com/WayneMessam/status/1067991053700091904","Miramar, FL"
"WayneMessam.771",2018-11-28 19:18:44,"WayneMessam","Mayor Wayne M. Messam invites #OurMiramar vendors to learn more about how your business can take advantage of BCPS Procurement Opportunities! Government Agencies will be be present to discuss their needs and how... https://t.co/B53XKzegv6","Facebook",FALSE,FALSE,2,0,NA,NA,"https://twitter.com/WayneMessam/status/1067860359997022215",NA
"WayneMessam.772",2018-11-28 16:39:01,"WayneMessam","Congrats Commissioner!! https://t.co/RDAG2HF4Xn","Twitter for iPhone",TRUE,FALSE,1,0,"LamarPFisher",NA,"https://twitter.com/WayneMessam/status/1067820168246697985","Miramar, FL"
"WayneMessam.773",2018-11-28 04:47:07,"WayneMessam","We are securing a vibrant city for our future generations. @CityofMiramar will be the most accessible, innovative and responsive city by 2030! #MiramarTogether #Believe https://t.co/2CyBkkUdJn","Twitter for iPhone",FALSE,FALSE,3,0,NA,NA,"https://twitter.com/WayneMessam/status/1067641010417795072","Miramar, FL"
