"","created_at","screen_name","text","source","is_quote","is_retweet","favorite_count","retweet_count","quoted_screen_name","retweet_screen_name","status_url","place_full_name"
"WayneMessam.1",2019-06-07 19:59:52,"WayneMessam","@TiffanyDCross Don<U+2019>t get me started on this 2020 Presidential race. Almost every candidate gets a CNN townhall except this mayor candidate. <U+0001F937><U+0001F3FE><U+200D><U+2642><U+FE0F> https://t.co/LZl9Gd0I07","Twitter for iPhone",FALSE,FALSE,14,9,NA,NA,"https://twitter.com/WayneMessam/status/1137086796360298497",NA
"WayneMessam.2",2019-06-07 01:08:17,"WayneMessam","I spent this evening with WorldWarII Veteran Luis A. Morales who is now 98 years old and landed on Omaha Beach in Normandy on this day 75 years ago. He is now a proud @CityofMiramar resident &amp; is an active senior in our community. We salute you sir #dd75thanniversary #PurpleHeart https://t.co/tHrhGsAUYv","Twitter for iPhone",FALSE,FALSE,24,2,NA,NA,"https://twitter.com/WayneMessam/status/1136802022857093125",NA
"WayneMessam.3",2019-06-07 01:03:32,"WayneMessam","So proud of our Miramar students. @MiamiDolphins @MiramarPD https://t.co/mTXMBctuIe","Twitter for iPhone",TRUE,FALSE,2,1,"MiramarPD",NA,"https://twitter.com/WayneMessam/status/1136800824888365058",NA
"WayneMessam.4",2019-06-06 22:53:03,"WayneMessam","@BenjaminFried19 @ChicoFreedom This cannot be further from truth. I am actively fighting Washington on the very existence of this facility in our city. I<U+2019>ve brought down our congressional delegation to point out the inhumane conditions at their facility. The fact is localgovernment can not regulate ICE.","Twitter for iPhone",FALSE,FALSE,0,1,NA,NA,"https://twitter.com/WayneMessam/status/1136767988772876288",NA
"WayneMessam.5",2019-06-06 17:56:55,"WayneMessam","When Cities and the federal government work collaboratively on infrastructure America Wins! #SOTC https://t.co/VhQ5ge219r","Twitter for iPhone",TRUE,FALSE,9,4,"leagueofcities",NA,"https://twitter.com/WayneMessam/status/1136693465683771392",NA
"WayneMessam.6",2019-06-06 12:07:43,"WayneMessam","Wayne's Got Your Back - https://t.co/tL8KO8L9SR https://t.co/tlU15ZkVKN","Mailchimp",FALSE,FALSE,5,2,NA,NA,"https://twitter.com/WayneMessam/status/1136605587024822272",NA
"WayneMessam.7",2019-06-06 11:36:29,"WayneMessam","Allied Forces embarked on the largest seaborne operation in history. Let<U+2019>s remember the lives lost that helped win World War II. I pay special recognition to the often forgotten soldier like the 320th Barrage Balloon Battalion &amp; Tuskegee Airmen. #DDay75thAnniversary https://t.co/WUlLVL2R4J","Buffer",FALSE,FALSE,18,6,NA,NA,"https://twitter.com/WayneMessam/status/1136597727708622849",NA
"WayneMessam.8",2019-06-05 20:07:20,"WayneMessam","Aye! Check Me Out! I don<U+2019>t know if y<U+2019>all know but the <U+201C>Real<U+201D> #MayorOfMiramar @waynemessam is running for #POTUS <U+201C>President of The United States<U+201D> &amp; he<U+2019>s determined. That<U+2019>s a major look, even for  us as residents!!<U+2026> https://t.co/P1hObh75Om","Twitter for iPhone",FALSE,TRUE,0,4,NA,"tonecdamayor","https://twitter.com/WayneMessam/status/1136363899178094597",NA
"WayneMessam.9",2019-06-05 14:18:34,"WayneMessam","Wayne's Got Your Back - https://t.co/jOY3CyJEEU
I believe we all can have access to health care! https://t.co/g15O74bost","Mailchimp",FALSE,FALSE,7,3,NA,NA,"https://twitter.com/WayneMessam/status/1136276129353015297",NA
"WayneMessam.10",2019-06-05 12:40:21,"WayneMessam","No better tradition in all of College Football. #Unconquered https://t.co/qIrMU6fkLV","Twitter for iPhone",TRUE,FALSE,8,1,"RedBroward",NA,"https://twitter.com/WayneMessam/status/1136251411069591552",NA
"WayneMessam.11",2019-06-04 19:27:11,"WayneMessam","Tune in now on @99jamz on with @SUPACINDY https://t.co/zmnqGwnLZd","Buffer",FALSE,FALSE,10,4,NA,NA,"https://twitter.com/WayneMessam/status/1135991406181400578",NA
"WayneMessam.12",2019-06-04 13:58:17,"WayneMessam","Is it true or false that sharing your Netflix password in Tennessee is illegal in the U.S.? Think you know the answer? Take this quiz to find out <U+270D><U+0001F3FE>https://t.co/05xCpUSMCt","Twitter for iPhone",FALSE,TRUE,0,3,NA,"BlavityPolitics","https://twitter.com/WayneMessam/status/1135908636620836866",NA
"WayneMessam.13",2019-06-04 01:21:05,"WayneMessam","I literally grew up watching @toddtongen on @WPLGLocal10. This news is very shocking and heartbreaking. Sincerest condolences to his family. https://t.co/4V32yVA44r","Twitter for iPhone",TRUE,FALSE,8,3,"WPLGLocal10",NA,"https://twitter.com/WayneMessam/status/1135718078094946304",NA
"WayneMessam.14",2019-06-04 00:30:40,"WayneMessam","Dems cannot take for granted young voters of color. Not only are they paying attention but they are never polled and they are ready to make an impact in 2020. #ImListening @BlavityPolitics @Blavity","Twitter for iPhone",FALSE,FALSE,24,10,NA,NA,"https://twitter.com/WayneMessam/status/1135705390807691270",NA
"WayneMessam.15",2019-06-03 13:56:00,"WayneMessam","The Palestinian People do have the right to self govern. I<U+2019>ve met Israeli and Palestinian leaders. They all want a two state solution. This administration has lost all credibility by failing to bring the both sides to the table. I will be an Honest Broker. https://t.co/9uGe54uzxk","Buffer",FALSE,FALSE,14,6,NA,NA,"https://twitter.com/WayneMessam/status/1135545674114711552",NA
"WayneMessam.16",2019-06-03 12:45:30,"WayneMessam","@AtoBoldon Edwin Moses was my track idol growing up. The only reason I was a hurdler and loved the intermediates.","Twitter for iPhone",FALSE,FALSE,2,1,NA,NA,"https://twitter.com/WayneMessam/status/1135527932947046401",NA
"WayneMessam.17",2019-06-03 12:04:06,"WayneMessam","Motivation Monday: Being a Trailblazer means doing what others are not willing or too afraid to do. Never deprive your burning desire to do the impossible. For if you do, the Impossible will be just that! #ChangeCantWait https://t.co/9voQeOfTXF https://t.co/fMnFqHlYFy","Buffer",FALSE,FALSE,15,5,NA,NA,"https://twitter.com/WayneMessam/status/1135517513729695745",NA
"WayneMessam.18",2019-06-02 16:07:01,"WayneMessam","I took a break on the trail in the northeast and visited @CRLStweets students in Cambridge, Massachusetts to share my story and to inspire them to be politically engaged as future leaders. https://t.co/Oz7BVC1X6e","Buffer",FALSE,FALSE,17,5,NA,NA,"https://twitter.com/WayneMessam/status/1135216256905297921",NA
"WayneMessam.19",2019-06-01 20:18:35,"WayneMessam","Today marks the first day of Hurricane Season. Take a quick moment to download the @CityofMiramar Hurricane Preparedness Guide. It is everyone<U+2019>s responsibility to ensure you have a plan and are prepared for the next hurricane.  https://t.co/U5QlBDHOof","Buffer",FALSE,FALSE,9,5,NA,NA,"https://twitter.com/WayneMessam/status/1134917175431585796",NA
"WayneMessam.20",2019-06-01 15:03:27,"WayneMessam","@RedBroward You know it!!! #Unconquered","Twitter for iPhone",FALSE,FALSE,1,1,NA,NA,"https://twitter.com/WayneMessam/status/1134837870668242944",NA
"WayneMessam.21",2019-06-01 13:15:48,"WayneMessam","No matter where I am on the campaign trail, I<U+2019>ll find a group of runners and enjoy our beautiful American Nature. https://t.co/Dd4Opb9yDp","Buffer",FALSE,FALSE,26,6,NA,NA,"https://twitter.com/WayneMessam/status/1134810781361627137",NA
"WayneMessam.22",2019-06-01 11:04:48,"WayneMessam","@petersob13 @YrOnlyHope @nminow Martin Milner? How old are you?","Twitter for iPhone",FALSE,TRUE,0,2,NA,"showbiz411","https://twitter.com/WayneMessam/status/1134777811921776640",NA
"WayneMessam.23",2019-06-01 00:56:16,"WayneMessam","My heart cries for the Virginia Beach victims lost and the survivors who must now make sense of this senseless act of gun violence. I<U+2019>m committed to doing my part to help make this nation a place where these incidents never happen ever.  https://t.co/stSuI4fR65","Twitter for iPhone",FALSE,FALSE,37,15,NA,NA,"https://twitter.com/WayneMessam/status/1134624670475542528",NA
"WayneMessam.24",2019-05-30 23:14:02,"WayneMessam","When seniors share the difficulties of accessing basic necessities like ice saving Prescription Medicines due to high costs, Washington Is Broken. I intend to change that! #ChangeCantWait https://t.co/AbJNdW3ZD1 https://t.co/4Qd0W8lbJF","Buffer",FALSE,FALSE,12,7,NA,NA,"https://twitter.com/WayneMessam/status/1134236555235745792",NA
"WayneMessam.25",2019-05-29 23:14:01,"WayneMessam","While the President and Congress can<U+2019>t even agree to meet to discuss Infrastructure, as mayor of Miramar, our city is investing $100 Million in our infrastructure. Cities can<U+2019>t wait on Washington. Another reason why I<U+2019>m running for POTUS.  https://t.co/XZf1QQ91nS","Buffer",FALSE,FALSE,14,10,NA,NA,"https://twitter.com/WayneMessam/status/1133874161481396224",NA
"WayneMessam.26",2019-05-29 17:15:59,"WayneMessam","Mueller stated that his investigation couldn<U+2019>t indict a sitting president and it was never an option. He also said if he had confidence the President didn<U+2019>t commit a crime, he would have stated so. Congress must now do its job of oversight and do what Mueller wasn<U+2019>t allowed to.","Twitter for iPhone",FALSE,FALSE,159,55,NA,NA,"https://twitter.com/WayneMessam/status/1133784059438612480",NA
"WayneMessam.27",2019-05-29 16:50:14,"WayneMessam","A mayor brings a unique qualification and perspective to the POTUS candidacy. We are closest to the people, we can<U+2019>t shut down our governments, we work with or without Washington. Our policy positions are built around what we<U+2019>ve already done as mayor. https://t.co/ysZD4Q3CIN https://t.co/yBNuGVR1M7","Buffer",FALSE,FALSE,9,3,NA,NA,"https://twitter.com/WayneMessam/status/1133777580895744001",NA
"WayneMessam.28",2019-05-28 16:07:03,"WayneMessam","To me it<U+2019>s simple, all we need in this nation is the political will to forgive outstanding student loans and to make a higher education free. Yes, it will cost more than we pay now. This investment ensures a strong and prepared workforce #EconomicSecurity
 https://t.co/S2p2uhTjl1","Buffer",FALSE,FALSE,13,5,NA,NA,"https://twitter.com/WayneMessam/status/1133404324434993152",NA
"WayneMessam.29",2019-05-28 15:03:33,"WayneMessam","@realDonaldTrump A President who<U+2019>s administration delays the release of the #HarrietTubman $20 Bill, call racist white nationalists <U+201C>good people<U+201D> or call Caribbean and African nations <U+201C>shit holes<U+201D> has an even worse chance to get the African American vote. Chip in Today! https://t.co/JCFT2IiJeR","Twitter for iPhone",FALSE,FALSE,13,4,NA,NA,"https://twitter.com/WayneMessam/status/1133388346355589121",NA
"WayneMessam.30",2019-05-28 14:57:47,"WayneMessam","As a son of Jamaican Immigrants, this is the example of how the immigrant community benefits America. My father labored in the hot S. Florida sugarcane fields while my mother was a cook who fed the men doing the same work. Now, their son is running for President! https://t.co/izQcLsTiLs","Twitter for iPhone",TRUE,FALSE,40,11,"CNN",NA,"https://twitter.com/WayneMessam/status/1133386895214489600",NA
"WayneMessam.31",2019-05-28 14:38:26,"WayneMessam","A President who<U+2019>s administration delays the release of the #HarrietTubman $20 Bill, call racist white nationalists <U+201C>good people<U+201D> or call Caribbean and African nations <U+201C>shit holes<U+201D> has an even worse chance to get the African American vote. Chip in Today! https://t.co/2VUhCw3w69 https://t.co/Iuc1WsT7n0","Twitter for iPhone",TRUE,FALSE,14,4,"realDonaldTrump",NA,"https://twitter.com/WayneMessam/status/1133382025510084610",NA
"WayneMessam.32",2019-05-28 14:18:21,"WayneMessam","Our prayers are with Indiana and Ohio as you recover and rebuild. Disasters are not political events. They impact families, communities and everyday people. https://t.co/bu8emCf51R","Twitter for iPhone",TRUE,FALSE,8,3,"TODAYshow",NA,"https://twitter.com/WayneMessam/status/1133376970018971649",NA
"WayneMessam.33",2019-05-28 13:56:02,"WayneMessam","Tuesday Testimony: In life you won<U+2019>t catch every tough pass. Get up. Dust off. Learn from the lesson &amp; Rise Up Stronger. America, 2016 may have been a missed opportunity but this nation can &amp; will Rise Up to serve All. I<U+2019>m convinced of that. Chip In Today! https://t.co/3kSjS7PDPV https://t.co/q5c1Jkz0Ey","Buffer",FALSE,FALSE,4,2,NA,NA,"https://twitter.com/WayneMessam/status/1133371352512106497",NA
"WayneMessam.34",2019-05-28 12:15:57,"WayneMessam","As the only @USGBC #LEEDAP running for President, the attack on Climate Science is very devastating. We cannot stick our head in the sand and not track the impacts of carbon emissions and hope it goes away. We must act now. This is simply malfeasance.  https://t.co/71KEHkHSsv","Buffer",FALSE,FALSE,7,2,NA,NA,"https://twitter.com/WayneMessam/status/1133346166333161472",NA
"WayneMessam.35",2019-05-27 22:06:20,"WayneMessam","We must never forget the many women who gave the ultimate sacrifice for our country. Their valor and courage to defend is not only needed in our armed forces but needed at the highest levels of our military. #MemorialDay2019 https://t.co/6WgbaIK4vX","Twitter for iPhone",FALSE,FALSE,15,1,NA,NA,"https://twitter.com/WayneMessam/status/1133132352404828160",NA
"WayneMessam.36",2019-05-27 17:21:39,"WayneMessam","@ABCPolitics In @CityofMiramar I initiated and had a ban pass making it illegal to sell these products to minors. We must also dedicate more resources to educate our youth of the potential dangers of vaping. https://t.co/QMIGZAyuRV","Twitter for iPhone",FALSE,FALSE,4,1,NA,NA,"https://twitter.com/WayneMessam/status/1133060710525804544",NA
"WayneMessam.37",2019-05-27 13:49:10,"WayneMessam","May this nation hold high the memory of the fallen who gave the ultimate sacrifice in the name of liberty. Their valor and service must never be forgotten. #MemorialDay2019 https://t.co/t73GVBtsiT","Twitter for iPhone",FALSE,FALSE,28,6,NA,NA,"https://twitter.com/WayneMessam/status/1133007239894175750",NA
"WayneMessam.38",2019-05-27 13:00:33,"WayneMessam","Thanks for your leadership Madame President. @leagueofcities https://t.co/TaPZi9C9lH","Twitter for iPhone",TRUE,FALSE,5,1,"karenaboutgary",NA,"https://twitter.com/WayneMessam/status/1132995004006313984",NA
"WayneMessam.39",2019-05-26 13:47:12,"WayneMessam","Tune in today as I guest appear on @WPLGLocal10 #ThisWeekInSouthFlorida at 11:30am with Michael Putney and @GlennaWPLG https://t.co/xbQxeEXlIy","Twitter for iPhone",FALSE,FALSE,11,4,NA,NA,"https://twitter.com/WayneMessam/status/1132644354227625986",NA
"WayneMessam.40",2019-05-25 23:31:06,"WayneMessam","@seanmpolster @TOWarrenton @DominionEnergy Wishing your city a speedy recovery!","Twitter Web Client",FALSE,FALSE,3,0,NA,NA,"https://twitter.com/WayneMessam/status/1132428909432201216",NA
"WayneMessam.41",2019-05-25 22:52:18,"WayneMessam","@bilalshabazz @AdamSextonWMUR Sir, that is incorrect. I am on record in my support of reparations. We must scientifically study the impacts on the descendents of enslaved people. Once the objective findings have been identified, then real solutions can be proposed and enforced to make that repair.","Twitter for iPhone",FALSE,FALSE,0,0,NA,NA,"https://twitter.com/WayneMessam/status/1132419148150181889",NA
"WayneMessam.42",2019-05-25 16:29:42,"WayneMessam","@BJohnsonICT @bilalshabazz I dedicated my entire term as @NBCLEO President to teaching local elected officials on how to legally establish #MWBE programs. Over 200 elected officials representing millions of Americans learned how remove bias barriers in their cities m. I am proud of my record.","Twitter for iPhone",FALSE,FALSE,1,0,NA,NA,"https://twitter.com/WayneMessam/status/1132322859957837824",NA
"WayneMessam.43",2019-05-25 15:00:57,"WayneMessam","@bilalshabazz @BJohnsonICT Correction, I was the first and only  candidate to propose forgiving <U+201C>all<U+201D> of the $1.5 Trillion in Outstanding Student Loan Debt. Other candidates followed with their own proposals that don<U+2019>t go as far as my proposal. Visit my website https://t.co/voXkDKCcU7.","Twitter for iPhone",FALSE,FALSE,1,0,NA,NA,"https://twitter.com/WayneMessam/status/1132300528141164545",NA
"WayneMessam.44",2019-05-25 14:37:45,"WayneMessam","Thanks for your leadership in Kansas! https://t.co/AjNxE7G5Ff","Twitter for iPhone",TRUE,FALSE,6,2,"BJohnsonICT",NA,"https://twitter.com/WayneMessam/status/1132294690630459393",NA
"WayneMessam.45",2019-05-25 14:08:28,"WayneMessam","@jsramos04 @RedBroward @AdamSextonWMUR In no way am I doing so. Lot of respect for @PeteButtigieg. My response to the question praised the unique qualifications of Mayors. Washington is broken and Americans need new leadership. This can very well be the year of the Mayor!","Twitter for iPhone",FALSE,FALSE,12,4,NA,NA,"https://twitter.com/WayneMessam/status/1132287320286224384",NA
"WayneMessam.46",2019-05-25 13:23:24,"WayneMessam","Miramar is larger than South Bend, more Fortune 500 companies &amp; more diverse, @AdamSextonWMUR asked if Race or White Privilege on why Mayor Pete has gotten more national exposure than me. I<U+2019>ll let the pundits decide and focus on he American people https://t.co/2VUhCw3w69 https://t.co/0b2ryMn3jA","Twitter for iPhone",FALSE,FALSE,42,19,NA,NA,"https://twitter.com/WayneMessam/status/1132275978724626432",NA
"WayneMessam.47",2019-05-25 12:10:49,"WayneMessam","Funding remains an issue in tight city budgets, but Miramar, FL Mayor Wayne Messam said that investment will ""not only be saviors of our city, but also saviors of our country."" https://t.co/viLRZGV2Y8 via @smartcitiesdive","Twitter for iPhone",FALSE,FALSE,4,3,NA,NA,"https://twitter.com/WayneMessam/status/1132257712455266309",NA
"WayneMessam.48",2019-05-24 22:58:55,"WayneMessam","These laws were passed to overturn #RoeVWade and the authors<U+2019> goal is to test them at the Supreme Court. I stand with women and their right to choose and will defend that right vigorously. This federal judge did the made the right verdict. https://t.co/ajKp6K90GC","Twitter for iPhone",TRUE,FALSE,19,5,"NBCNews",NA,"https://twitter.com/WayneMessam/status/1132058423405760512",NA
"WayneMessam.49",2019-05-23 20:13:01,"WayneMessam","Had an opportunity to interview on @WBUR, Boston<U+2019>s largest radio news room after my visit to Southern New Hampshire. Audio replay is available here. https://t.co/vjfMZrbSOb","Buffer",FALSE,FALSE,4,2,NA,NA,"https://twitter.com/WayneMessam/status/1131654284213465088",NA
"WayneMessam.50",2019-05-23 18:52:10,"WayneMessam","As President, I will vigorously defend the a woman<U+2019>s right to choose and nominate a @USSupremeCourt justice that recognizes his question became settled law in 1973.","Twitter for iPhone",FALSE,FALSE,7,1,NA,NA,"https://twitter.com/WayneMessam/status/1131633938496204805",NA
"WayneMessam.51",2019-05-23 18:49:15,"WayneMessam","I am convinced that these conservative state law makers are intentionally passing these laws in hope to overturn #RoeVWade. The question is whether the newly conservatively leaning @USSupremeCourt will rule in their favor. https://t.co/kHI4gNUTn9","Twitter for iPhone",TRUE,FALSE,9,4,"ABCPolitics",NA,"https://twitter.com/WayneMessam/status/1131633207114391552","Arlington, VA"
"WayneMessam.52",2019-05-23 13:18:49,"WayneMessam","Participating in a panel with the @leagueofcities discussing the State of the Cities across America #STOC https://t.co/M8A8mJOTWw","Twitter for iPhone",FALSE,FALSE,20,7,NA,NA,"https://twitter.com/WayneMessam/status/1131550047294971904","National League of Cities"
"WayneMessam.53",2019-05-23 00:28:27,"WayneMessam","@CoachHubb0597 Don<U+2019>t take it personal. I Love the ACC. <U+0001F44A><U+0001F3FE><U+0001F44A><U+0001F3FE><U+0001F44A><U+0001F3FE>","Twitter for iPhone",FALSE,FALSE,2,0,NA,NA,"https://twitter.com/WayneMessam/status/1131356179437936646",NA
"WayneMessam.54",2019-05-23 00:19:21,"WayneMessam","@TheEllenShow I heard you were asking if your viewers heard of me. Let<U+2019>s do one better, invite me on your show! What you say? #ChangeCantWait https://t.co/WM1ct9svyo","Twitter for iPhone",FALSE,FALSE,3,1,NA,NA,"https://twitter.com/WayneMessam/status/1131353890501341184",NA
"WayneMessam.55",2019-05-23 00:17:09,"WayneMessam","All I can say is, the more people see me, the more they want to learn more about my campaign. I<U+2019>m a mayor. A Business Owner. A Husband. A Father. A former star football player for @Seminoles Chip In to get me on the debate stage! https://t.co/Boitsw0R0U https://t.co/AJX0xuXfj3","Twitter for iPhone",TRUE,FALSE,27,9,"sheelavanhoose",NA,"https://twitter.com/WayneMessam/status/1131353334059872258",NA
"WayneMessam.56",2019-05-22 20:13:01,"WayneMessam","Democrats are looking for someone tough enough to #KnockDownTrump. Is this tough enough for you? #ChangeCantWait Donate to get Wayne on the Debate Stage https://t.co/khKflCuc4j https://t.co/AcUl105H5e","Buffer",FALSE,FALSE,12,4,NA,NA,"https://twitter.com/WayneMessam/status/1131291896876290048",NA
"WayneMessam.57",2019-05-22 16:07:03,"WayneMessam","Access to healthcare is a matter of civil right. No American should fret not being able to see a doctor and should never fear about their preexisting conditions. #ChangeCantWait Help Wayne get on the debate stage. https://t.co/rMQctxSdeh https://t.co/2QbrdYI8eg","Buffer",FALSE,FALSE,6,4,NA,NA,"https://twitter.com/WayneMessam/status/1131230000190054401",NA
"WayneMessam.58",2019-05-22 13:56:01,"WayneMessam","WMUR-TV in studio town hall taping w/ New Hampshire Voters featured policy topics. Tens of Thousands of voters now know who Wayne is. The more voters see Wayne, the more traction he gets. Donate today to to help get Wayne in front of more donors. https://t.co/3t0bMhYay9 https://t.co/t7FNS8FAbY","Buffer",FALSE,FALSE,6,3,NA,NA,"https://twitter.com/WayneMessam/status/1131197024135720965",NA
"WayneMessam.59",2019-05-21 23:14:01,"WayneMessam","Meeting Dems at today<U+2019>s Meet and Greet in Goffstown with New Hampshire Young Democrats is our commitment to listen to the needs of young voters. We discussed Voting Rights and Climate Change as key issues important to New Hampshire Young Dems Donate today https://t.co/ZjuakVnbnH https://t.co/7lni1HZKYw","Buffer",FALSE,FALSE,8,1,NA,NA,"https://twitter.com/WayneMessam/status/1130975059017961474",NA
"WayneMessam.60",2019-05-21 14:54:36,"WayneMessam","Great conversation this morning on @WMUR9 with @AdamSextonWMUR  and New Hampshire voters during the televised town hall. https://t.co/BJnjZBdTrU","Twitter for iPhone",FALSE,FALSE,11,3,NA,NA,"https://twitter.com/WayneMessam/status/1130849378254565377",NA
"WayneMessam.61",2019-05-21 12:50:50,"WayneMessam","In New Hampshire for a televised town hall on @WMUR9.  And wait to speak with the voters! #ChangeCantWait https://t.co/dH9yVp5Jqv https://t.co/uQsGYqeips","Twitter for iPhone",FALSE,FALSE,16,5,NA,NA,"https://twitter.com/WayneMessam/status/1130818230833078272",NA
"WayneMessam.62",2019-05-21 02:50:54,"WayneMessam","Sad to hear of the passing of former @floridastate President Sandy D'Alemberte. He was my president while I served as @FSUSGA Vice President. Loved his intellect and dapper bow ties. He will be missed. #Unconquered
 https://t.co/GEKNOksK7U","Buffer",FALSE,FALSE,10,3,NA,NA,"https://twitter.com/WayneMessam/status/1130667252171329543",NA
"WayneMessam.63",2019-05-20 21:18:37,"WayneMessam","ICYMI: Presidential candidate @WayneMessam - mayor of Miramar, FL -- will make his 2nd visit to #fitn NH tomorrow. He'll attend a meet/greet with @NHYoungDems at A&amp;E/Apotheca Flowers, Goffstown, at 1 pm #fitn #nhpolitics via @jdistaso https://t.co/NwvydkFjJj","Twitter for iPhone",FALSE,TRUE,0,3,NA,"WMUR9","https://twitter.com/WayneMessam/status/1130583631645368320",NA
"WayneMessam.64",2019-05-20 16:50:14,"WayneMessam","Thank you sir! Share with your friends and relatives and ask them to support the campaign in anyway they can. We can do this! https://t.co/Boitsw0R0U https://t.co/JvCS0iYpcS","Twitter for iPhone",TRUE,FALSE,6,2,"LaMonteColeman1",NA,"https://twitter.com/WayneMessam/status/1130516090109517824",NA
"WayneMessam.65",2019-05-20 15:16:57,"WayneMessam","Looking forward to the visit!!! Let<U+2019>s go @NHYoungDems #ChangeCantWait https://t.co/8qYI8PgmcM","Twitter for iPhone",TRUE,FALSE,6,4,"NHYoungDems",NA,"https://twitter.com/WayneMessam/status/1130492612530585602",NA
"WayneMessam.66",2019-05-20 13:18:30,"WayneMessam","Monday Motivation: I am convinced that negative thoughts are your greatest Dream Killers. Control your thoughts so you can conquer your dreams. #ChangeCantWait  https://t.co/tDzbnYhuuy https://t.co/NIDDM3u61G","Buffer",FALSE,FALSE,8,5,NA,NA,"https://twitter.com/WayneMessam/status/1130462805935742976",NA
"WayneMessam.67",2019-05-19 20:33:51,"WayneMessam","According to the Palestinian and Israeli leadership, continued settlements on key Palestinian territory jeopardizes the ability to establish borders for a two state solution. As President, I will work with both sides to bring them together. https://t.co/kEne7yPWbQ","Twitter for iPhone",FALSE,FALSE,9,1,NA,NA,"https://twitter.com/WayneMessam/status/1130209977275158528",NA
"WayneMessam.68",2019-05-19 20:28:24,"WayneMessam","America must facilitate bringing both the Israeli &amp; Palestinian leaders together to negotiate the establishment of a two state solution. We must restore America<U+2019>s position as an honest broker holding both sides accountable. What we<U+2019>ve seen from this administration is the opposite https://t.co/4rG15iREnN","Twitter for iPhone",FALSE,FALSE,10,2,NA,NA,"https://twitter.com/WayneMessam/status/1130208606794735616","Miramar, FL"
